,Authors,Title,Affiliations,Published Date,Journal Name ,Subjects,Volume,Issue,DOI,URL
1410,Brian D. Kluger; Steve B. Wyatt,Are Judgment Errors Reflected in Market Prices and Allocations? Experimental Evidence Based on the Monty Hall Problem,,2004-6,The Journal of Finance,Economics and Econometrics; Finance; Accounting,59,3,10.1111/j.1540-6261.2004.00654.x,http://dx.doi.org/10.1111/j.1540-6261.2004.00654.x
1411,SANDRO BRUSCO; FABIO CASTIGLIONESI,"Liquidity Coinsurance, Moral Hazard, and Financial Contagion",,2007-10,The Journal of Finance,Economics and Econometrics; Finance; Accounting,62,5,10.1111/j.1540-6261.2007.01275.x,http://dx.doi.org/10.1111/j.1540-6261.2007.01275.x
1412,PHILIPP K. ILLEDITSCH; JAYANT V. GANGULI; SCOTT CONDIE,Information Inertia,,2021-2,The Journal of Finance,Economics and Econometrics; Finance; Accounting,76,1,10.1111/jofi.12979,http://dx.doi.org/10.1111/jofi.12979
1413,CEM DEMIROGLU; OGUZHAN OZBAS; RUI C. SILVA; MEHMET FATİH ULU,Do Physiological and Spiritual Factors Affect Economic Decisions?,,2021-10,The Journal of Finance,Economics and Econometrics; Finance; Accounting,76,5,10.1111/jofi.13032,http://dx.doi.org/10.1111/jofi.13032
1414,Tobias J. Moskowitz,Discussion,,2000-8,The Journal of Finance,Economics and Econometrics; Finance; Accounting,55,4,10.1111/0022-1082.00264,http://dx.doi.org/10.1111/0022-1082.00264
1415,STEVEN L. HESTON; CHRISTOPHER S. JONES; MEHDI KHORRAM; SHUAIQI LI; HAITAO MO,Option Momentum,,,The Journal of Finance,Economics and Econometrics; Finance; Accounting,,,10.1111/jofi.13279,http://dx.doi.org/10.1111/jofi.13279
1416,ROBERT DEYOUNG; ANNE GRON; GӦKHAN TORNA; ANDREW WINTON,Risk Overhang and Loan Portfolio Decisions: Small Business Loan Supply before and during the Financial Crisis,,2015-12,The Journal of Finance,Economics and Econometrics; Finance; Accounting,70,6,10.1111/jofi.12356,http://dx.doi.org/10.1111/jofi.12356
1417,Alfonso Dufour; Robert F. Engle,Time and the Price Impact of a Trade,,2000-12,The Journal of Finance,Economics and Econometrics; Finance; Accounting,55,6,10.1111/0022-1082.00297,http://dx.doi.org/10.1111/0022-1082.00297
1418,GEERT BEKAERT; CAMPBELL R. HARVEY; CHRISTIAN LUNDBLAD; STEPHAN SIEGEL,Global Growth Opportunities and Market Integration,,2007-6,The Journal of Finance,Economics and Econometrics; Finance; Accounting,62,3,10.1111/j.1540-6261.2007.01231.x,http://dx.doi.org/10.1111/j.1540-6261.2007.01231.x
1419,Paola Sapienza,The Effects of Banking Mergers on Loan Contracts,,2002-2,The Journal of Finance,Economics and Econometrics; Finance; Accounting,57,1,10.1111/1540-6261.00424,http://dx.doi.org/10.1111/1540-6261.00424
1420,Per Strömberg,Conflicts of Interest and Market Illiquidity in Bankruptcy Auctions: Theory and Tests,,2000-12,The Journal of Finance,Economics and Econometrics; Finance; Accounting,55,6,10.1111/0022-1082.00302,http://dx.doi.org/10.1111/0022-1082.00302
1421,ROBERT BATTALIO; PAUL SCHULTZ,Regulatory Uncertainty and Market Liquidity: The 2008 Short Sale Ban's Impact on Equity Option Markets,,2011-12,The Journal of Finance,Economics and Econometrics; Finance; Accounting,66,6,10.1111/j.1540-6261.2011.01700.x,http://dx.doi.org/10.1111/j.1540-6261.2011.01700.x
1422,MICHAEL W. BRANDT; KENNETH A. KAVAJECZ,Price Discovery in the U.S. Treasury Market: The Impact of Orderflow and Liquidity on the Yield Curve,,2004-12,The Journal of Finance,Economics and Econometrics; Finance; Accounting,59,6,10.1111/j.1540-6261.2004.00711.x,http://dx.doi.org/10.1111/j.1540-6261.2004.00711.x
1423,TOR‐ERIK BAKKE; TONI M. WHITED,Threshold Events and Identification: A Study of Cash Shortfalls,,2012-6,The Journal of Finance,Economics and Econometrics; Finance; Accounting,67,3,10.1111/j.1540-6261.2012.01742.x,http://dx.doi.org/10.1111/j.1540-6261.2012.01742.x
1424,CAMELIA M. KUHNEN,"Business Networks, Corporate Governance, and Contracting in the Mutual Fund Industry",,2009-10,The Journal of Finance,Economics and Econometrics; Finance; Accounting,64,5,10.1111/j.1540-6261.2009.01498.x,http://dx.doi.org/10.1111/j.1540-6261.2009.01498.x
1425,MYRON B. SLOVIN; MARIE E. SUSHKA; JOHN A. POLONCHEK,Methods of Payment in Asset Sales: Contracting with Equity versus Cash,,2005-10,The Journal of Finance,Economics and Econometrics; Finance; Accounting,60,5,10.1111/j.1540-6261.2005.00802.x,http://dx.doi.org/10.1111/j.1540-6261.2005.00802.x
1426,DAN COVITZ; CHRIS DOWNING,Liquidity or Credit Risk? The Determinants of Very Short‐Term Corporate Yield Spreads,,2007-10,The Journal of Finance,Economics and Econometrics; Finance; Accounting,62,5,10.1111/j.1540-6261.2007.01276.x,http://dx.doi.org/10.1111/j.1540-6261.2007.01276.x
1427,SIMON GERVAIS; J. B. HEATON; TERRANCE ODEAN,"Overconfidence, Compensation Contracts, and Capital Budgeting",,2011-10,The Journal of Finance,Economics and Econometrics; Finance; Accounting,66,5,10.1111/j.1540-6261.2011.01686.x,http://dx.doi.org/10.1111/j.1540-6261.2011.01686.x
1428,Tarun Chordia; Bhaskaran Swaminathan,Trading Volume and Cross‐Autocorrelations in Stock Returns,,2000-4,The Journal of Finance,Economics and Econometrics; Finance; Accounting,55,2,10.1111/0022-1082.00231,http://dx.doi.org/10.1111/0022-1082.00231
1429,JOHN M. GRIFFIN; JEFFREY H. HARRIS; TAO SHU; SELIM TOPALOGLU,Who Drove and Burst the Tech Bubble?,,2011-8,The Journal of Finance,Economics and Econometrics; Finance; Accounting,66,4,10.1111/j.1540-6261.2011.01663.x,http://dx.doi.org/10.1111/j.1540-6261.2011.01663.x
1430,PAVEL G. SAVOR; QI LU,Do Stock Mergers Create Value for Acquirers?,,2009-6,The Journal of Finance,Economics and Econometrics; Finance; Accounting,64,3,10.1111/j.1540-6261.2009.01459.x,http://dx.doi.org/10.1111/j.1540-6261.2009.01459.x
1431,Daniel J. Bradley; Bradford D. Jordan; Jay R. Ritter,The Quiet Period Goes out with a Bang,,2003-2,The Journal of Finance,Economics and Econometrics; Finance; Accounting,58,1,10.1111/1540-6261.00517,http://dx.doi.org/10.1111/1540-6261.00517
1432,MURRAY CARLSON; ADLAI FISHER; RON GIAMMARINO,Corporate Investment and Asset Price Dynamics: Implications for SEO Event Studies and Long‐Run Performance,,2006-6,The Journal of Finance,Economics and Econometrics; Finance; Accounting,61,3,10.1111/j.1540-6261.2006.00865.x,http://dx.doi.org/10.1111/j.1540-6261.2006.00865.x
1433,LUCIAN A. BEBCHUK; YANIV GRINSTEIN; URS PEYER,Lucky CEOs and Lucky Directors,,2010-12,The Journal of Finance,Economics and Econometrics; Finance; Accounting,65,6,10.1111/j.1540-6261.2010.01618.x,http://dx.doi.org/10.1111/j.1540-6261.2010.01618.x
1434,MARA FACCIO; RONALD W. MASULIS,The Choice of Payment Method in European Mergers and Acquisitions,,2005-6,The Journal of Finance,Economics and Econometrics; Finance; Accounting,60,3,10.1111/j.1540-6261.2005.00764.x,http://dx.doi.org/10.1111/j.1540-6261.2005.00764.x
1435,ARNOUD W. A. BOOT; RADHAKRISHNAN GOPALAN; ANJAN V. THAKOR,The Entrepreneur's Choice between Private and Public Ownership,,2006-4,The Journal of Finance,Economics and Econometrics; Finance; Accounting,61,2,10.1111/j.1540-6261.2006.00855.x,http://dx.doi.org/10.1111/j.1540-6261.2006.00855.x
1436,TIM ADAM; SUDIPTO DASGUPTA; SHERIDAN TITMAN,"Financial Constraints, Competition, and Hedging in Industry Equilibrium",,2007-10,The Journal of Finance,Economics and Econometrics; Finance; Accounting,62,5,10.1111/j.1540-6261.2007.01280.x,http://dx.doi.org/10.1111/j.1540-6261.2007.01280.x
1437,Catherine Casamatta,Financing and Advising: Optimal Financial Contracts with Venture Capitalists,,2003-10,The Journal of Finance,Economics and Econometrics; Finance; Accounting,58,5,10.1111/1540-6261.00597,http://dx.doi.org/10.1111/1540-6261.00597
1438,PÉTER KONDOR; DIMITRI VAYANOS,Liquidity Risk and the Dynamics of Arbitrage Capital,,2019-6,The Journal of Finance,Economics and Econometrics; Finance; Accounting,74,3,10.1111/jofi.12757,http://dx.doi.org/10.1111/jofi.12757
1439,EFRAIM BENMELECH; NITTAI K. BERGMAN,Bankruptcy and the Collateral Channel,,2011-4,The Journal of Finance,Economics and Econometrics; Finance; Accounting,66,2,10.1111/j.1540-6261.2010.01636.x,http://dx.doi.org/10.1111/j.1540-6261.2010.01636.x
1440,SAMUEL M. HARTZMARK; KELLY SHUE,A Tough Act to Follow: Contrast Effects in Financial Markets,,2018-8,The Journal of Finance,Economics and Econometrics; Finance; Accounting,73,4,10.1111/jofi.12685,http://dx.doi.org/10.1111/jofi.12685
1441,JEAN HELWEGE; CHRISTO PIRINSKY; RENÉ M. STULZ,Why Do Firms Become Widely Held? An Analysis of the Dynamics of Corporate Ownership,,2007-6,The Journal of Finance,Economics and Econometrics; Finance; Accounting,62,3,10.1111/j.1540-6261.2007.01229.x,http://dx.doi.org/10.1111/j.1540-6261.2007.01229.x
1442,CHRISTOPHER P. CLIFFORD; WILLIAM C. GERKEN,Property Rights to Client Relationships and Financial Advisor Incentives,,2021-10,The Journal of Finance,Economics and Econometrics; Finance; Accounting,76,5,10.1111/jofi.13058,http://dx.doi.org/10.1111/jofi.13058
1443,MELANIE CAO; RONG WANG,Optimal CEO Compensation with Search: Theory and Empirical Evidence,,2013-10,The Journal of Finance,Economics and Econometrics; Finance; Accounting,68,5,10.1111/jofi.12069,http://dx.doi.org/10.1111/jofi.12069
1444,TERRENCE HENDERSHOTT; ANANTH MADHAVAN,Click or Call? Auction versus Search in the Over‐the‐Counter Market,,2015-2,The Journal of Finance,Economics and Econometrics; Finance; Accounting,70,1,10.1111/jofi.12164,http://dx.doi.org/10.1111/jofi.12164
1445,Jing‐zhi Huang; Liuren Wu,Specification Analysis of Option Pricing Models Based on Time‐Changed Lévy Processes,,2004-6,The Journal of Finance,Economics and Econometrics; Finance; Accounting,59,3,10.1111/j.1540-6261.2004.00667.x,http://dx.doi.org/10.1111/j.1540-6261.2004.00667.x
1446,Carol L. Osler,Currency Orders and Exchange Rate Dynamics: An Explanation for the Predictive Success of Technical Analysis,,2003-10,The Journal of Finance,Economics and Econometrics; Finance; Accounting,58,5,10.1111/1540-6261.00588,http://dx.doi.org/10.1111/1540-6261.00588
1447,CASEY DOUGAL; JOSEPH ENGELBERG; CHRISTOPHER A. PARSONS; EDWARD D. VAN WESEP,Anchoring on Credit Spreads,,2015-6,The Journal of Finance,Economics and Econometrics; Finance; Accounting,70,3,10.1111/jofi.12248,http://dx.doi.org/10.1111/jofi.12248
1448,PANKAJ K. JAIN,Financial Market Design and the Equity Premium: Electronic versus Floor Trading,,2005-12,The Journal of Finance,Economics and Econometrics; Finance; Accounting,60,6,10.1111/j.1540-6261.2005.00822.x,http://dx.doi.org/10.1111/j.1540-6261.2005.00822.x
1449,GIOVANNI DELL'ARICCIA; ROBERT MARQUEZ,Risk and the Corporate Structure of Banks,,2010-6,The Journal of Finance,Economics and Econometrics; Finance; Accounting,65,3,10.1111/j.1540-6261.2010.01561.x,http://dx.doi.org/10.1111/j.1540-6261.2010.01561.x
1450,MATTI KELOHARJU; KJELL G. NYBORG; KRISTIAN RYDQVIST,Strategic Behavior and Underpricing in Uniform Price Auctions: Evidence from Finnish Treasury Auctions,,2005-8,The Journal of Finance,Economics and Econometrics; Finance; Accounting,60,4,10.1111/j.1540-6261.2005.00782.x,http://dx.doi.org/10.1111/j.1540-6261.2005.00782.x
1451,Michael J. Barclay; Terrence Hendershott,Liquidity Externalities and Adverse Selection: Evidence from Trading after Hours,,2004-4,The Journal of Finance,Economics and Econometrics; Finance; Accounting,59,2,10.1111/j.1540-6261.2004.00646.x,http://dx.doi.org/10.1111/j.1540-6261.2004.00646.x
1452,MASAHIRO WATANABE,Price Volatility and Investor Behavior in an Overlapping Generations Model with Information Asymmetry,,2008-2,The Journal of Finance,Economics and Econometrics; Finance; Accounting,63,1,10.1111/j.1540-6261.2008.01315.x,http://dx.doi.org/10.1111/j.1540-6261.2008.01315.x
1453,PABLO RUIZ‐VERDÚ; RAVI SINGH,"Public Thrift, Private Perks: Signaling Board Independence with Executive Pay",,2021-4,The Journal of Finance,Economics and Econometrics; Finance; Accounting,76,2,10.1111/jofi.12989,http://dx.doi.org/10.1111/jofi.12989
1454,ANDREW DETZEL; ROBERT NOVY‐MARX; MIHAIL VELIKOV,Model Comparison with Transaction Costs,,2023-6,The Journal of Finance,Economics and Econometrics; Finance; Accounting,78,3,10.1111/jofi.13225,http://dx.doi.org/10.1111/jofi.13225
1455,ERIK P. GILJE; ELENA LOUTSKINA; PHILIP E. STRAHAN,Exporting Liquidity: Branch Banking and Financial Integration,,2016-6,The Journal of Finance,Economics and Econometrics; Finance; Accounting,71,3,10.1111/jofi.12387,http://dx.doi.org/10.1111/jofi.12387
1456,JOHANNES STROEBEL,Asymmetric Information about Collateral Values,,2016-6,The Journal of Finance,Economics and Econometrics; Finance; Accounting,71,3,10.1111/jofi.12288,http://dx.doi.org/10.1111/jofi.12288
1457,MATTHIAS KAHL; ANIL SHIVDASANI; YIHUI WANG,Short‐Term Debt as Bridge Financing: Evidence from the Commercial Paper Market,,2015-2,The Journal of Finance,Economics and Econometrics; Finance; Accounting,70,1,10.1111/jofi.12216,http://dx.doi.org/10.1111/jofi.12216
1458,PIERRE BACHAS; PAUL GERTLER; SEAN HIGGINS; ENRIQUE SEIRA,How Debit Cards Enable the Poor to Save More,,2021-8,The Journal of Finance,Economics and Econometrics; Finance; Accounting,76,4,10.1111/jofi.13021,http://dx.doi.org/10.1111/jofi.13021
1459,Hans R. Stoll,Presidential Address: Friction,,2000-8,The Journal of Finance,Economics and Econometrics; Finance; Accounting,55,4,10.1111/0022-1082.00259,http://dx.doi.org/10.1111/0022-1082.00259
1460,ERNAN HARUVY; CHARLES N. NOUSSAIR,The Effect of Short Selling on Bubbles and Crashes in Experimental Spot Asset Markets,,2006-6,The Journal of Finance,Economics and Econometrics; Finance; Accounting,61,3,10.1111/j.1540-6261.2006.00868.x,http://dx.doi.org/10.1111/j.1540-6261.2006.00868.x
1461,MARCO DI MAGGIO; AMIR KERMANI; KAVEH MAJLESI,Stock Market Returns and Consumption,,2020-12,The Journal of Finance,Economics and Econometrics; Finance; Accounting,75,6,10.1111/jofi.12968,http://dx.doi.org/10.1111/jofi.12968
1462,Pierre Collin‐Dufresne; Bruno Solnik,On the Term Structure of Default Premia in the Swap and LIBOR Markets,,2001-6,The Journal of Finance,Economics and Econometrics; Finance; Accounting,56,3,10.1111/0022-1082.00357,http://dx.doi.org/10.1111/0022-1082.00357
1463,WEI JIANG; KAI LI; WEI WANG,Hedge Funds and Chapter 11,,2012-4,The Journal of Finance,Economics and Econometrics; Finance; Accounting,67,2,10.1111/j.1540-6261.2012.01724.x,http://dx.doi.org/10.1111/j.1540-6261.2012.01724.x
1464,JONATHAN B. COHN; MALCOLM I. WARDLAW,Financing Constraints and Workplace Safety,,2016-10,The Journal of Finance,Economics and Econometrics; Finance; Accounting,71,5,10.1111/jofi.12430,http://dx.doi.org/10.1111/jofi.12430
1465,KENNETH M. LEHN; MENGXIN ZHAO,CEO Turnover after Acquisitions: Are Bad Bidders Fired?,,2006-8,The Journal of Finance,Economics and Econometrics; Finance; Accounting,61,4,10.1111/j.1540-6261.2006.00889.x,http://dx.doi.org/10.1111/j.1540-6261.2006.00889.x
1466,SANJIV RANJAN DAS; RAMAN UPPAL,Systemic Risk and International Portfolio Choice,,2004-12,The Journal of Finance,Economics and Econometrics; Finance; Accounting,59,6,10.1111/j.1540-6261.2004.00717.x,http://dx.doi.org/10.1111/j.1540-6261.2004.00717.x
1467,MICHAEL EWENS; MATTHEW RHODES‐KROPF,Is a VC Partnership Greater Than the Sum of Its Partners?,,2015-6,The Journal of Finance,Economics and Econometrics; Finance; Accounting,70,3,10.1111/jofi.12249,http://dx.doi.org/10.1111/jofi.12249
1468,JEAN‐NOËL BARROT; RAMANA NANDA,The Employment Effects of Faster Payment: Evidence from the Federal Quickpay Reform,,2020-12,The Journal of Finance,Economics and Econometrics; Finance; Accounting,75,6,10.1111/jofi.12955,http://dx.doi.org/10.1111/jofi.12955
1469,MAGNUS DAHLQUIST; OFER SETTY; ROINE VESTMAN,On the Asset Allocation of a Default Pension Fund,,2018-8,The Journal of Finance,Economics and Econometrics; Finance; Accounting,73,4,10.1111/jofi.12697,http://dx.doi.org/10.1111/jofi.12697
1470,JONATHAN GOLDBERG; YOSHIO NOZAWA,Liquidity Supply in the Corporate Bond Market,,2021-4,The Journal of Finance,Economics and Econometrics; Finance; Accounting,76,2,10.1111/jofi.12991,http://dx.doi.org/10.1111/jofi.12991
1471,E. HAN KIM; PAIGE OUIMET,Broad‐Based Employee Stock Ownership: Motives and Outcomes,,2014-6,The Journal of Finance,Economics and Econometrics; Finance; Accounting,69,3,10.1111/jofi.12150,http://dx.doi.org/10.1111/jofi.12150
1472,ARVIND KRISHNAMURTHY; STEFAN NAGEL; DMITRY ORLOV,Sizing Up Repo,,2014-12,The Journal of Finance,Economics and Econometrics; Finance; Accounting,69,6,10.1111/jofi.12168,http://dx.doi.org/10.1111/jofi.12168
1473,C. EDWARD FEE; CHARLES J. HADLOCK; SHAWN THOMAS,Corporate Equity Ownership and the Governance of Product Market Relationships,,2006-6,The Journal of Finance,Economics and Econometrics; Finance; Accounting,61,3,10.1111/j.1540-6261.2006.00871.x,http://dx.doi.org/10.1111/j.1540-6261.2006.00871.x
1474,RONALD C. ANDERSON; DAVID M. REEB; WANLI ZHAO,Family‐Controlled Firms and Informed Trading: Evidence from Short Sales,,2012-2,The Journal of Finance,Economics and Econometrics; Finance; Accounting,67,1,10.1111/j.1540-6261.2011.01714.x,http://dx.doi.org/10.1111/j.1540-6261.2011.01714.x
1475,David A. Chapman; Neil D. Pearson,Is the Short Rate Drift Actually Nonlinear?,,2000-2,The Journal of Finance,Economics and Econometrics; Finance; Accounting,55,1,10.1111/0022-1082.00208,http://dx.doi.org/10.1111/0022-1082.00208
1476,ITAMAR DRECHSLER; ALEXI SAVOV; PHILIPP SCHNABL,A Model of Monetary Policy and Risk Premia,,2018-2,The Journal of Finance,Economics and Econometrics; Finance; Accounting,73,1,10.1111/jofi.12539,http://dx.doi.org/10.1111/jofi.12539
1477,VIRAL V. ACHARYA; HEITOR ALMEIDA; MURILLO CAMPELLO,Aggregate Risk and the Choice between Cash and Lines of Credit,,2013-10,The Journal of Finance,Economics and Econometrics; Finance; Accounting,68,5,10.1111/jofi.12056,http://dx.doi.org/10.1111/jofi.12056
1478,MARGARITA TSOUTSOURA,The Effect of Succession Taxes on Family Firm Investment: Evidence from a Natural Experiment,,2015-4,The Journal of Finance,Economics and Econometrics; Finance; Accounting,70,2,10.1111/jofi.12224,http://dx.doi.org/10.1111/jofi.12224
1479,DANIEL R. CAVAGNARO; BERK A. SENSOY; YINGDI WANG; MICHAEL S. WEISBACH,Measuring Institutional Investors’ Skill at Making Private Equity Investments,,2019-12,The Journal of Finance,Economics and Econometrics; Finance; Accounting,74,6,10.1111/jofi.12783,http://dx.doi.org/10.1111/jofi.12783
1480,Mark Grinblatt; Matti Keloharju,What Makes Investors Trade?,,2001-4,The Journal of Finance,Economics and Econometrics; Finance; Accounting,56,2,10.1111/0022-1082.00338,http://dx.doi.org/10.1111/0022-1082.00338
1481,VIRAL V. ACHARYA; KATHARINA BERGANT; MATTEO CROSIGNANI; TIM EISERT; FERGAL MCCANN,The Anatomy of the Transmission of Macroprudential Policies,,2022-10,The Journal of Finance,Economics and Econometrics; Finance; Accounting,77,5,10.1111/jofi.13170,http://dx.doi.org/10.1111/jofi.13170
1482,ROGER K. LOH; RENÉ M. STULZ,Is Sell‐Side Research More Valuable in Bad Times?,,2018-6,The Journal of Finance,Economics and Econometrics; Finance; Accounting,73,3,10.1111/jofi.12611,http://dx.doi.org/10.1111/jofi.12611
1483,Robert M. Conroy; Kenneth M. Eades; Robert S. Harris,A Test of the Relative Pricing Effects of Dividends and Earnings: Evidence from Simultaneous Announcements in Japan,,2000-6,The Journal of Finance,Economics and Econometrics; Finance; Accounting,55,3,10.1111/0022-1082.00245,http://dx.doi.org/10.1111/0022-1082.00245
1484,HARRY P. HUIZINGA; JOHANNES VOGET,International Taxation and the Direction and Volume of Cross‐Border M&amp;As,,2009-6,The Journal of Finance,Economics and Econometrics; Finance; Accounting,64,3,10.1111/j.1540-6261.2009.01463.x,http://dx.doi.org/10.1111/j.1540-6261.2009.01463.x
1485,THIERRY FOUCAULT; ALBERT J. MENKVELD,Competition for Order Flow and Smart Order Routing Systems,,2008-2,The Journal of Finance,Economics and Econometrics; Finance; Accounting,63,1,10.1111/j.1540-6261.2008.01312.x,http://dx.doi.org/10.1111/j.1540-6261.2008.01312.x
1486,DOUGLAS W. DIAMOND; ZHIGUO HE,A Theory of Debt Maturity: The Long and Short of Debt Overhang,,2014-4,The Journal of Finance,Economics and Econometrics; Finance; Accounting,69,2,10.1111/jofi.12118,http://dx.doi.org/10.1111/jofi.12118
1487,Sandra Renfro Callaghan; Christopher B. Barry,Tax‐Induced Trading of Equity Securities: Evidence from the ADR Market,,2003-8,The Journal of Finance,Economics and Econometrics; Finance; Accounting,58,4,10.1111/1540-6261.00578,http://dx.doi.org/10.1111/1540-6261.00578
1488,Glenn W. Boyle; Graeme A. Guthrie,"Investment, Uncertainty, and Liquidity",,2003-10,The Journal of Finance,Economics and Econometrics; Finance; Accounting,58,5,10.1111/1540-6261.00600,http://dx.doi.org/10.1111/1540-6261.00600
1489,Jeffrey L. Coles; Chun‐Keung Hoi,New Evidence on the Market for Directors: Board Membership and Pennsylvania Senate Bill 1310,,2003-2,The Journal of Finance,Economics and Econometrics; Finance; Accounting,58,1,10.1111/1540-6261.00522,http://dx.doi.org/10.1111/1540-6261.00522
1490,ALEXANDER LJUNGQVIST; FELICIA MARSTON; WILLIAM J. WILHELM,Competing for Securities Underwriting Mandates: Banking Relationships and Analyst Recommendations,,2006-2,The Journal of Finance,Economics and Econometrics; Finance; Accounting,61,1,10.1111/j.1540-6261.2006.00837.x,http://dx.doi.org/10.1111/j.1540-6261.2006.00837.x
1491,NICOLA GENNAIOLI; ANDREI SHLEIFER; ROBERT W. VISHNY,A Model of Shadow Banking,,2013-8,The Journal of Finance,Economics and Econometrics; Finance; Accounting,68,4,10.1111/jofi.12031,http://dx.doi.org/10.1111/jofi.12031
1492,LONG CHEN; DAVID A. LESMOND; JASON WEI,Corporate Yield Spreads and Bond Liquidity,,2007-2,The Journal of Finance,Economics and Econometrics; Finance; Accounting,62,1,10.1111/j.1540-6261.2007.01203.x,http://dx.doi.org/10.1111/j.1540-6261.2007.01203.x
1493,VICENTE CUÑAT; MIREIA GINE; MARIA GUADALUPE,The Vote Is Cast: The Effect of Corporate Governance on Shareholder Value,,2012-10,The Journal of Finance,Economics and Econometrics; Finance; Accounting,67,5,10.1111/j.1540-6261.2012.01776.x,http://dx.doi.org/10.1111/j.1540-6261.2012.01776.x
1494,MARIASSUNTA GIANNETTI; GUANMIN LIAO; XIAOYUN YU,The Brain Gain of Corporate Boards: Evidence from China,,2015-8,The Journal of Finance,Economics and Econometrics; Finance; Accounting,70,4,10.1111/jofi.12198,http://dx.doi.org/10.1111/jofi.12198
1495,Charles J. Hadlock; Christopher M. James,Do Banks Provide Financial Slack?,,2002-6,The Journal of Finance,Economics and Econometrics; Finance; Accounting,57,3,10.1111/1540-6261.00464,http://dx.doi.org/10.1111/1540-6261.00464
1496,HAITAO LI; FENG ZHAO,Unspanned Stochastic Volatility: Evidence from Hedging Interest Rate Derivatives,,2006-2,The Journal of Finance,Economics and Econometrics; Finance; Accounting,61,1,10.1111/j.1540-6261.2006.00838.x,http://dx.doi.org/10.1111/j.1540-6261.2006.00838.x
1497,PIERRE COLLIN‐DUFRESNE; ROBERT S. GOLDSTEIN; CHRISTOPHER S. JONES,Identification of Maximal Affine Term Structure Models,,2008-4,The Journal of Finance,Economics and Econometrics; Finance; Accounting,63,2,10.1111/j.1540-6261.2008.01331.x,http://dx.doi.org/10.1111/j.1540-6261.2008.01331.x
1498,BRYAN KELLY; SEMYON MALAMUD; LASSE HEJE PEDERSEN,Principal Portfolios,,2023-2,The Journal of Finance,Economics and Econometrics; Finance; Accounting,78,1,10.1111/jofi.13199,http://dx.doi.org/10.1111/jofi.13199
1499,MICHAEL KIRCHLER; FLORIAN LINDNER; UTZ WEITZEL,Rankings and Risk‐Taking in the Finance Industry,,2018-10,The Journal of Finance,Economics and Econometrics; Finance; Accounting,73,5,10.1111/jofi.12701,http://dx.doi.org/10.1111/jofi.12701
1500,Edwin J. Elton; Martin J. Gruber; Jeffrey A. Busse,Are Investors Rational? Choices among Index Funds,,2004-2,The Journal of Finance,Economics and Econometrics; Finance; Accounting,59,1,10.1111/j.1540-6261.2004.00633.x,http://dx.doi.org/10.1111/j.1540-6261.2004.00633.x
1501,NEIL BHUTTA; JANE DOKKO; HUI SHAN,Consumer Ruthlessness and Mortgage Default during the 2007 to 2009 Housing Bust,,2017-12,The Journal of Finance,Economics and Econometrics; Finance; Accounting,72,6,10.1111/jofi.12523,http://dx.doi.org/10.1111/jofi.12523
1502,LUIGI GUISO; PAOLA SAPIENZA; LUIGI ZINGALES,The Determinants of Attitudes toward Strategic Default on Mortgages,,2013-8,The Journal of Finance,Economics and Econometrics; Finance; Accounting,68,4,10.1111/jofi.12044,http://dx.doi.org/10.1111/jofi.12044
1503,TERRY O'MALLEY,The Impact of Repossession Risk on Mortgage Default,,2021-4,The Journal of Finance,Economics and Econometrics; Finance; Accounting,76,2,10.1111/jofi.12990,http://dx.doi.org/10.1111/jofi.12990
1504,JEFFREY R. BROWN; ZORAN IVKOVIĆ; PAUL A. SMITH; SCOTT WEISBENNER,Neighbors Matter: Causal Community Effects and Stock Market Participation,,2008-6,The Journal of Finance,Economics and Econometrics; Finance; Accounting,63,3,10.1111/j.1540-6261.2008.01364.x,http://dx.doi.org/10.1111/j.1540-6261.2008.01364.x
1505,RAFAEL LA PORTA; FLORENCIO LOPEZ‐DE‐SILANES; ANDREI SHLEIFER,What Works in Securities Laws?,,2006-2,The Journal of Finance,Economics and Econometrics; Finance; Accounting,61,1,10.1111/j.1540-6261.2006.00828.x,http://dx.doi.org/10.1111/j.1540-6261.2006.00828.x
1506,DIEGO GARCÍA,Sentiment during Recessions,,2013-6,The Journal of Finance,Economics and Econometrics; Finance; Accounting,68,3,10.1111/jofi.12027,http://dx.doi.org/10.1111/jofi.12027
1507,PO‐HSUAN HSU; KAI LI; CHI‐YANG TSOU,The Pollution Premium,,2023-6,The Journal of Finance,Economics and Econometrics; Finance; Accounting,78,3,10.1111/jofi.13217,http://dx.doi.org/10.1111/jofi.13217
1508,MICHAEL J. COOPER; HUSEYIN GULEN; ALEXEI V. OVTCHINNIKOV,Corporate Political Contributions and Stock Returns,,2010-4,The Journal of Finance,Economics and Econometrics; Finance; Accounting,65,2,10.1111/j.1540-6261.2009.01548.x,http://dx.doi.org/10.1111/j.1540-6261.2009.01548.x
