,Authors,Title,Affiliations,Published Date,Journal Name ,Subjects,Volume,Issue,DOI,URL
154,Josef Hofbauer; William H. Sandholm,Survival of dominated strategies under evolutionary dynamics,"Department of Mathematics, University of Vienna; josef.hofbauer@univie.ac.at; Department of Economics, University of Wisconsin; whs@ssc.wisc.edu",2011/09/01,Theoretical Economics,"General Economics, Econometrics and Finance",6,3,10.3982/te771,http://dx.doi.org/10.3982/te771
155,Tugce Cuhadaroglu,Choosing on influence,School of Economics and Finance; University of St. Andrews,2017-5,Theoretical Economics,"General Economics, Econometrics and Finance",12,2,10.3982/te2170,http://dx.doi.org/10.3982/te2170
156,Nikita Roketskiy,Competition and networks of collaboration,Department of EconomicsUniversity College London,2018/09/01,Theoretical Economics,"General Economics, Econometrics and Finance",13,3,10.3982/te2492,http://dx.doi.org/10.3982/te2492
157,Luis H. B. Braido,Ergodic Markov equilibrium with incomplete markets and short sales,"Graduate School of Economics, Getulio Vargas Foundation; lbraido@fgv.br",2013/01/01,Theoretical Economics,"General Economics, Econometrics and Finance",8,1,10.3982/te799,http://dx.doi.org/10.3982/te799
158,Andrew Mackenzie; Christian Trudeau,On Groves mechanisms for costly inclusion,"Department of Microeconomics and Public Economics, Maastricht University; Department of Economics, University of Windsor",,Theoretical Economics,"General Economics, Econometrics and Finance",18,3,10.3982/te4289a,http://dx.doi.org/10.3982/te4289a
159,Andrew Ellis; Michele Piccione; Shengxing Zhang,Equilibrium securitization with diverse beliefs,"Department of Economics, London School of Economics and Political Science; Department of Economics, London School of Economics and Political Science; Department of Economics, London School of Economics and Political Science",,Theoretical Economics,"General Economics, Econometrics and Finance",17,1,10.3982/te4157,http://dx.doi.org/10.3982/te4157
160,Mira Frick,Monotone threshold representations,Cowles Foundation for Research in Economics; Yale University,2016-9,Theoretical Economics,"General Economics, Econometrics and Finance",11,3,10.3982/te1547,http://dx.doi.org/10.3982/te1547
161,Wonki Jo Cho; Biung-Ghi Ju,Multinary group identification,Department of Economics; Korea University; Department of Economics; Seoul National University,2017-5,Theoretical Economics,"General Economics, Econometrics and Finance",12,2,10.3982/te2156,http://dx.doi.org/10.3982/te2156
162,Frédéric Koessler; Vasiliki Skreta,Selling with evidence,"CNRS, Paris School of Economics; Department of Economics, University of Texas at Austin; Department of Economics, University College London",,Theoretical Economics,"General Economics, Econometrics and Finance",14,2,10.3982/te2885,http://dx.doi.org/10.3982/te2885
163,Daisuke Nakajima,"First-price auctions, Dutch auctions, and buy-it-now prices with Allais paradox bidders","Department of Economics, University of Michigan; ndaisuke@umich.edu",2011/09/01,Theoretical Economics,"General Economics, Econometrics and Finance",6,3,10.3982/te502,http://dx.doi.org/10.3982/te502
164,Hector Chade; Jeroen Swinkels,"The no‐upward‐crossing condition, comparative statics, and the moral‐hazard problem","Department of Economics, Arizona State University; Kellogg School of Management, Northwestern University",,Theoretical Economics,"General Economics, Econometrics and Finance",15,2,10.3982/te2937,http://dx.doi.org/10.3982/te2937
165,Andrew Ellis,Condorcet meets Ellsberg,Department of Economics; London School of Economics and Political Science,2016-9,Theoretical Economics,"General Economics, Econometrics and Finance",11,3,10.3982/te1284,http://dx.doi.org/10.3982/te1284
166,Marcin Pęski; Thomas Wiseman,A folk theorem for stochastic games with infrequent state changes,Department of Economics; University of Toronto; Department of Economics; University of Texas at Austin,2015-1,Theoretical Economics,"General Economics, Econometrics and Finance",10,1,10.3982/te1512,http://dx.doi.org/10.3982/te1512
167,Juan F. Escobar; Qiaoxi Zhang,Delegating learning,"Department of Industrial Engineering, University of Chile; School of Economics, Xiamen University; Departmento de Economía, Universidad Diego Portales",,Theoretical Economics,"General Economics, Econometrics and Finance",16,2,10.3982/te4191,http://dx.doi.org/10.3982/te4191
168,Federica Ceron; Stéphane Gonzalez,Approval voting without ballot restrictions,"Department of Economics, University Jean Monnet, University of Lyon, GATE Lyon Saint-Etienne; Department of Economics, University Jean Monnet, University of Lyon, GATE Lyon Saint-Etienne",,Theoretical Economics,"General Economics, Econometrics and Finance",16,3,10.3982/te4087,http://dx.doi.org/10.3982/te4087
169,Lutz G. Arnold,On the neutrality of socially responsible investing: The general equilibrium perspective,"Department of Economics, University of Regensburg",,Theoretical Economics,"General Economics, Econometrics and Finance",18,1,10.3982/te4719,http://dx.doi.org/10.3982/te4719
170,Joel P. Flynn; Lawrence D. W. Schmidt; Alexis Akira Toda,Robust comparative statics for the elasticity of intertemporal substitution,"Department of Economics, Massachusetts Institute of Technology; Sloan School of Management, Massachusetts Institute of Technology; Department of Economics, University of California San Diego",,Theoretical Economics,"General Economics, Econometrics and Finance",18,1,10.3982/te4117,http://dx.doi.org/10.3982/te4117
171,Uzi Segal,∀ or ∃?,"Department of Economics, Boston College",,Theoretical Economics,"General Economics, Econometrics and Finance",18,1,10.3982/te4946,http://dx.doi.org/10.3982/te4946
172,M. Ali Khan; Kali P. Rath; Yeneng Sun; Haomiao Yu,Strategic uncertainty and the ex post Nash property in large games,Department of Economics; Johns Hopkins University; Department of Economics; University of Notre Dame; Department of Economics; National University of Singapore; Department of Economics; Ryerson University,2015-1,Theoretical Economics,"General Economics, Econometrics and Finance",10,1,10.3982/te1492,http://dx.doi.org/10.3982/te1492
173,Gabrielle Gayer; Dotan Persitz,Negotiation across multiple issues,Departmentof Economics; Bar Ilan University; Coller School of Management; Tel Aviv University,2016-9,Theoretical Economics,"General Economics, Econometrics and Finance",11,3,10.3982/te1865,http://dx.doi.org/10.3982/te1865
174,David S. Ahn; Federico Echenique; Kota Saito,On path independent stochastic choice,"Department of Economics; University of California, Berkeley; Division of the Humanities and Social Sciences; California Institute of Technology; Division of the Humanities and Social Sciences; California Institute of Technology",2018-1,Theoretical Economics,"General Economics, Econometrics and Finance",13,1,10.3982/te2653,http://dx.doi.org/10.3982/te2653
175,Yingni Guo; Eran Shmaya,Costly miscalibration,"Department of Economics, Northwestern University; Department of Economics, Stony Brook University",,Theoretical Economics,"General Economics, Econometrics and Finance",16,2,10.3982/te3991,http://dx.doi.org/10.3982/te3991
176,Ángel Hernando-Veciana; Fabio Michelucci,Inefficient rushes in auctions,Departamento de Economia; Universidad Carlos III; CERGE-EI,2018-1,Theoretical Economics,"General Economics, Econometrics and Finance",13,1,10.3982/te2513,http://dx.doi.org/10.3982/te2513
177,Laurens Cherchye; Thomas Demuynck; Bram De Rock,Is utility transferable? A revealed preference analysis,Center for Economic Studies; University of Leuven; Department of Economics; University of Maastricht; ECARES; Université Libre de Bruxelles,2015-1,Theoretical Economics,"General Economics, Econometrics and Finance",10,1,10.3982/te1560,http://dx.doi.org/10.3982/te1560
178,Christopher P. Chambers; Alan D. Miller,Benchmarking,Department of Economics; Georgetown University; Faculty of Law and Department of Economics; University of Haifa,2018-5,Theoretical Economics,"General Economics, Econometrics and Finance",13,2,10.3982/te2506,http://dx.doi.org/10.3982/te2506
179,Martin Szydlowski,"Incentives, project choice, and dynamic multitasking","Department of Finance, Carlson School of Management, University of Minnesota",,Theoretical Economics,"General Economics, Econometrics and Finance",14,3,10.3982/te2858,http://dx.doi.org/10.3982/te2858
180,Begum Guney; Michael Richter,Games with switching costs and endogenous references,"Department of Economics, Ozyegin University; Department of Economics, Royal Holloway; Department of Economics, Baruch College",,Theoretical Economics,"General Economics, Econometrics and Finance",17,2,10.3982/te4169,http://dx.doi.org/10.3982/te4169
181,Francis Bloch; Bhaskar Dutta; Mihai Manea,Efficient partnership formation in networks,"Paris School of Economics; Department of Economics, University of Warwick; Department of Economics, Ashoka University; Department of Economics, Stony Brook University",,Theoretical Economics,"General Economics, Econometrics and Finance",14,3,10.3982/te3453,http://dx.doi.org/10.3982/te3453
182,Christopher P. Chambers; Federico Echenique; Eran Shmaya,General revealed preference theory,"Department of Economics; University of California, San Diego; Division of the Humanities and Social Sciences; California Institute of Technology; Kellogg School of Management; Northwestern University",2017-5,Theoretical Economics,"General Economics, Econometrics and Finance",12,2,10.3982/te1924,http://dx.doi.org/10.3982/te1924
183,Lars Ehlers; Alexander Westkamp,Strategy-proof tie-breaking in matching with priorities,"Département de Sciences Économiques and CIREQUniversité de Montréal; Department of Management, Economics and Social SciencesUniversity of Cologne",2018/09/01,Theoretical Economics,"General Economics, Econometrics and Finance",13,3,10.3982/te2547,http://dx.doi.org/10.3982/te2547
184,Shinsuke Kambe,"An 
            <i>N</i>‐person war of attrition with the possibility of a noncompromising type","Faculty of Economics, Gakushuin University",,Theoretical Economics,"General Economics, Econometrics and Finance",14,3,10.3982/te3158,http://dx.doi.org/10.3982/te3158
185,Jianjun Miao; Jieran Wu; Eric R. Young,Macro‐financial volatility under dispersed information,"Department of Economics, Boston University; School of Economics, Zhejiang University; Department of Economics, University of Virginia; School of Economics, Zhejiang University",,Theoretical Economics,"General Economics, Econometrics and Finance",16,1,10.3982/te3872,http://dx.doi.org/10.3982/te3872
186,Paul Heidhues; Botond Koszegi; Philipp Strack,Convergence in models of misspecified learning,"Düsseldorf Institute for Competition Economics, Heinrich-Heine Universität Düsseldorf; Department of Economics and Business, Central European University; Department of Economics, Yale University",,Theoretical Economics,"General Economics, Econometrics and Finance",16,1,10.3982/te3558,http://dx.doi.org/10.3982/te3558
187,Kfir Eliaz; Ran Spiegler,On the strategic use of attention grabbers,"Department of Economics, Brown University; Kfir_Eliaz@Brown.edu; Department of Economics, University College London and Tel Aviv University; r.spiegler@ucl.ac.uk",2011/01/01,Theoretical Economics,"General Economics, Econometrics and Finance",6,1,10.3982/te758,http://dx.doi.org/10.3982/te758
188,Yves Balasko,The transfer problem: A complete characterization,"Department of Economics, PUC–Rio de Janeiro and Department of Economics, University of York; yves@balasko.com",2014/05/01,Theoretical Economics,"General Economics, Econometrics and Finance",9,2,10.3982/te1356,http://dx.doi.org/10.3982/te1356
189,Andrea Attar; Thomas Mariotti; François Salanié,Nonexclusive competition under adverse selection,"Toulouse School of Economics and Facoltà di Economia, Università degli Studi di Roma “Tor Vergata”; andrea.attar@tse-fr.eu; Toulouse School of Economics; thomas.mariotti@tse-fr.eu; Toulouse School of Economics; francois.salanie@tse-fr.eu",2014/01/01,Theoretical Economics,"General Economics, Econometrics and Finance",9,1,10.3982/te1126,http://dx.doi.org/10.3982/te1126
190,Yu Awaya; Vijay Krishna,Communication and cooperation in repeated games,"Department of Economics, University of Rochester; Department of Economics, Pennsylvania State University",,Theoretical Economics,"General Economics, Econometrics and Finance",14,2,10.3982/te3049,http://dx.doi.org/10.3982/te3049
191,Aviad Heifetz; Willemien Kets,Robust multiplicity with a grain of naiveté,Department of Management and Economics; Open University of Israel; Department of Economics; University of Oxford,2018-1,Theoretical Economics,"General Economics, Econometrics and Finance",13,1,10.3982/te2098,http://dx.doi.org/10.3982/te2098
192,Makoto Nirei; John Stachurski; Tsutomu Watanabe,Trade clustering and power laws in financial markets,"Graduate School of Economics, University of Tokyo; Research School of Economics, Australian National University; Graduate School of Economics, University of Tokyo",,Theoretical Economics,"General Economics, Econometrics and Finance",15,4,10.3982/te3523,http://dx.doi.org/10.3982/te3523
193,Francisco Alvarez-Cuadrado; Ngo Van Long; Markus Poschke,"Capital-labor substitution, structural change, and growth",Department of Economics; McGill University; Department of Economics; McGill University; Department of Economics; McGill University,2017-9,Theoretical Economics,"General Economics, Econometrics and Finance",12,3,10.3982/te2106,http://dx.doi.org/10.3982/te2106
194,Anton Kolotilin; Hongyi Li,Relational communication,"School of Economics, UNSW Business School; School of Economics, UNSW Business School",,Theoretical Economics,"General Economics, Econometrics and Finance",16,4,10.3982/te3734,http://dx.doi.org/10.3982/te3734
195,Drew Fudenberg; Gleb Romanyuk; Philipp Strack,Active learning with a misspecified prior,Department of Economics; Massachusetts Institute of Technology; Department of Economics; Harvard University; Department of Economics; University of California Berkeley,2017-9,Theoretical Economics,"General Economics, Econometrics and Finance",12,3,10.3982/te2480,http://dx.doi.org/10.3982/te2480
196,Christopher P. Chambers; Federico Echenique,On the consistency of data with bargaining theories,"Department of Economics, University of California, San Diego; cpchambers@dssmail.ucsd.edu; Division of the Humanities and Social Sciences, California Institute of Technology; fede@caltech.edu",2014/01/01,Theoretical Economics,"General Economics, Econometrics and Finance",9,1,10.3982/te1095,http://dx.doi.org/10.3982/te1095
197,Costis Skiadas,Scale-invariant uncertainty-averse preferences and source-dependent constant relative risk aversion,"Kellogg School of Management, Northwestern University; c-skiadas@kellogg.northwestern.edu",2013/01/01,Theoretical Economics,"General Economics, Econometrics and Finance",8,1,10.3982/te1004,http://dx.doi.org/10.3982/te1004
198,Yves Balasko,On the number of critical equilibria separating two equilibria,"Department of Economics, University of York; yves.balasko@york.ac.uk",2012/01/01,Theoretical Economics,"General Economics, Econometrics and Finance",7,1,10.3982/te822,http://dx.doi.org/10.3982/te822
199,Sebastian Gryglewicz; Aaron Kolb,Dynamic signaling with stochastic stakes,"Erasmus School of Economics, Erasmus University Rotterdam; Department of Business Economics and Public Policy, Indiana University Kelley School of Business",,Theoretical Economics,"General Economics, Econometrics and Finance",17,2,10.3982/te3710,http://dx.doi.org/10.3982/te3710
200,Paul Heidhues; Botond Kőszegi,Regular prices and sales,"European School of Management and Technology; paul.heidhues@esmt.org; Department of Economics, Central European University; botond@econ.berkeley.edu",2014/01/01,Theoretical Economics,"General Economics, Econometrics and Finance",9,1,10.3982/te1274,http://dx.doi.org/10.3982/te1274
201,Julien Prat; Boyan Jovanovic,Dynamic contracts when the agent's quality is unknown,CNRS; CREST; IAE; Barcelona GSE; Department of Economics; New York University,2014-9,Theoretical Economics,"General Economics, Econometrics and Finance",9,3,10.3982/te1439,http://dx.doi.org/10.3982/te1439
202,Daisuke Oyama; William H. Sandholm; Olivier Tercieux,Sampling best response dynamics and deterministic equilibrium selection,Faculty of Economics; University of Tokyo; Department of Economics; University of Wisconsin; Paris School of Economics; CNRS,2015-1,Theoretical Economics,"General Economics, Econometrics and Finance",10,1,10.3982/te1405,http://dx.doi.org/10.3982/te1405
203,Mihai Manea,"Bottleneck links, essential intermediaries, and competing paths of diffusion in networks","Department of Economics, Stony Brook University",,Theoretical Economics,"General Economics, Econometrics and Finance",16,3,10.3982/te4385,http://dx.doi.org/10.3982/te4385
204,Paul J. Healy; Laurent Mathevet,Designing stable mechanisms for economic environments,"Department of Economics, The Ohio State University; healy.52@osu.edu; Department of Economics, University of Texas; lmath@mail.utexas.edu",2012/09/01,Theoretical Economics,"General Economics, Econometrics and Finance",7,3,10.3982/te898,http://dx.doi.org/10.3982/te898
205,Dirk Bergemann; Benjamin Brooks; Stephen Morris,Countering the winner's curse: Optimal auction design in a common value model,"Department of Economics, Yale University; Department of Economics, University of Chicago; Department of Economics, Massachusetts Institute of Technology",,Theoretical Economics,"General Economics, Econometrics and Finance",15,4,10.3982/te3797,http://dx.doi.org/10.3982/te3797
206,Yuval Heller,Three steps ahead,Department of Economics; University of Oxford,2015-1,Theoretical Economics,"General Economics, Econometrics and Finance",10,1,10.3982/te1660,http://dx.doi.org/10.3982/te1660
207,Daron Acemoglu; Kostas Bimpikis; Asuman Ozdaglar,Dynamics of information exchange in endogenous social networks,"Department of Economics, Massachusetts Institute of Technology; daron@mit.edu; Graduate School of Business, Stanford University; kostasb@stanford.edu; Department of Electrical Engineering and Computer Science, Massachusetts Institute of Technology; asuman@mit.edu",2014/01/01,Theoretical Economics,"General Economics, Econometrics and Finance",9,1,10.3982/te1204,http://dx.doi.org/10.3982/te1204
208,Daron Acemoglu; William B. Hawkins,Search with multi-worker firms,Department of Economics; Massachusetts Institute of Technology; Department of Economics; Yeshiva University,2014-9,Theoretical Economics,"General Economics, Econometrics and Finance",9,3,10.3982/te1061,http://dx.doi.org/10.3982/te1061
209,Ulrich Doraszelski; Juan F. Escobar,Protocol invariance and the timing of decisions in dynamic games,"Wharton School, University of Pennsylvania; Department of Industrial Engineering, University of Chile",,Theoretical Economics,"General Economics, Econometrics and Finance",14,2,10.3982/te3230,http://dx.doi.org/10.3982/te3230
210,Michal Szkup,Multiplier effect and comparative statics in global games of regime change,"Department of Economics, University of British Columbia",,Theoretical Economics,"General Economics, Econometrics and Finance",15,2,10.3982/te3074,http://dx.doi.org/10.3982/te3074
211,Olivier Loisel,The implementation of stabilization policy,"CREST, ENSAE Paris, Institut Polytechnique de Paris",,Theoretical Economics,"General Economics, Econometrics and Finance",16,2,10.3982/te3322,http://dx.doi.org/10.3982/te3322
212,Martin F. Hellwig,Incomplete‐information games in large populations with anonymity,Max Planck Institute for Research on Collective Goods,,Theoretical Economics,"General Economics, Econometrics and Finance",17,1,10.3982/te4066,http://dx.doi.org/10.3982/te4066
213,Harry Pei,Trust and betrayals: Reputational payoffs and behaviors without commitment,"Department of Economics, Northwestern University",,Theoretical Economics,"General Economics, Econometrics and Finance",16,2,10.3982/te4182,http://dx.doi.org/10.3982/te4182
214,William H. Sandholm; Mathias Staudigl,Large deviations and stochastic stability in the small noise double limit,Department of Economics; University of Wisconsin; Department of Quantitative Economics; Maastricht University,2016-1,Theoretical Economics,"General Economics, Econometrics and Finance",11,1,10.3982/te1905,http://dx.doi.org/10.3982/te1905
215,Takuo Sugaya; Alexander Wolitzky,Bounding equilibrium payoffs in repeated games with private monitoring,Graduate School of Business; Stanford University; Department of Economics; MIT,2017-5,Theoretical Economics,"General Economics, Econometrics and Finance",12,2,10.3982/te2270,http://dx.doi.org/10.3982/te2270
216,Chad Fulton,Choosing what to pay attention to,"Research and Statistics, Federal Reserve Board of Governors",,Theoretical Economics,"General Economics, Econometrics and Finance",17,1,10.3982/te3850,http://dx.doi.org/10.3982/te3850
217,Mikel Pérez-Nievas; José I. Conde-Ruiz; Eduardo L. Giménez,Efficiency and endogenous fertility,"Departamento de Fundamentos da Análise Económica, Universidade de Santiago de Compostela; Departamento de Fundamentos del Análisis Económico I, Universidad Complutense de Madrid and Fundación de Estudios de Economía Aplicada; Departamento de Fundamentos da Análise Económica, Historia e Institucións Económicas, Universidade de Vigo and Research Group in Economic Analysis",,Theoretical Economics,"General Economics, Econometrics and Finance",14,2,10.3982/te2138,http://dx.doi.org/10.3982/te2138
218,Eduardo M. Azevedo; E. Glen Weyl; Alexander White,"Walrasian equilibrium in large, quasilinear markets","Wharton School, University of Pennsylvania; eazevedo@wharton.upenn.edu; Department of Economics, University of Chicago; weyl@uchicago.edu; School of Economics and Management, Tsinghua University; awhite@sem.tsinghua.edu.cn",2013/05/01,Theoretical Economics,"General Economics, Econometrics and Finance",8,2,10.3982/te1060,http://dx.doi.org/10.3982/te1060
219,Carolina Manzano; Xavier Vives,Market power and welfare in asymmetric divisible good auctions,"Department of Economics, Universitat Rovira i Virgili; Department of Economics, IESE Business School",,Theoretical Economics,"General Economics, Econometrics and Finance",16,3,10.3982/te3675,http://dx.doi.org/10.3982/te3675
220,William H. Sandholm; Segismundo S. Izquierdo; Luis R. Izquierdo,Best experienced payoff dynamics and cooperation in the centipede game,"Department of Economics, University of Wisconsin; BioEcoUva, Department of Industrial Organization, Universidad de Valladolid; Department of Civil Engineering, Universidad de Burgos",,Theoretical Economics,"General Economics, Econometrics and Finance",14,4,10.3982/te3565,http://dx.doi.org/10.3982/te3565
221,Marc Fleurbaey; John E. Roemer,Judicial precedent as a dynamic rationale for axiomatic bargaining theory,"CERSES, CNRS, and Université Paris Descartes; marc.fleurbaey@parisdescartes.fr; Departments of Political Science and Economics, Yale University; john.roemer@yale.edu",2011/05/01,Theoretical Economics,"General Economics, Econometrics and Finance",6,2,10.3982/te588,http://dx.doi.org/10.3982/te588
222,Aurélien Baillon; Yan Xu,Simple bets to elicit private signals,"Erasmus School of Economics, Erasmus University Rotterdam; Department of Economics, University of Vienna",,Theoretical Economics,"General Economics, Econometrics and Finance",16,3,10.3982/te4343,http://dx.doi.org/10.3982/te4343
223,Ilya Segal; Michael D. Whinston,A simple status quo that ensures participation (with application to efficient bargaining),"Department of Economics, Stanford University; ilya.segal@stanford.edu; Department of Economics, Northwestern University; mwhinston@northwestern.edu",2011/01/01,Theoretical Economics,"General Economics, Econometrics and Finance",6,1,10.3982/te591,http://dx.doi.org/10.3982/te591
224,David M. Arseneau; David E. Rappoport W.; Alexandros P. Vardoulakis,Private and public liquidity provision in over‐the‐counter markets,Federal Reserve Board; Federal Reserve Board; Federal Reserve Board,,Theoretical Economics,"General Economics, Econometrics and Finance",15,4,10.3982/te3419,http://dx.doi.org/10.3982/te3419
225,Scott Duke Kominers; Tayfun Sönmez,Matching with slot-specific priorities: Theory,Society of Fellows; Harvard University; Department of Economics; Boston College,2016-5,Theoretical Economics,"General Economics, Econometrics and Finance",11,2,10.3982/te1839,http://dx.doi.org/10.3982/te1839
226,David Martimort; Aggey Semenov; Lars A. Stole,A complete characterization of equilibria in an intrinsic common agency screening game,Ecole des Hautes Etudes en Sciences SocialesParis School of Economics; Department of EconomicsUniversity of Ottawa; Booth School of BusinessUniversity of Chicago,2018/09/01,Theoretical Economics,"General Economics, Econometrics and Finance",13,3,10.3982/te2266,http://dx.doi.org/10.3982/te2266
227,Filippo Massari,Market selection in large economies: A matter of luck,"School of Banking and Finance, University of New South Wales",,Theoretical Economics,"General Economics, Econometrics and Finance",14,2,10.3982/te2456,http://dx.doi.org/10.3982/te2456
228,Manuel Amador; Kyle Bagwell,Regulating a monopolist with uncertain costs without transfers,"Federal Reserve Bank of Minneapolis; Department of Economics, University of Minnesota; Department of Economics, Stanford University",,Theoretical Economics,"General Economics, Econometrics and Finance",17,4,10.3982/te4691,http://dx.doi.org/10.3982/te4691
229,Joyee Deb; Julio González-Díaz,Enforcing social norms: Trust‐building and community enforcement,"Department of Economics, Yale University; Department of Economics, University of Santiago de Compostela",,Theoretical Economics,"General Economics, Econometrics and Finance",14,4,10.3982/te2404,http://dx.doi.org/10.3982/te2404
